pa_5,cchs_questionnaire,,radio,"I exercise or am physically active on a regular basis.","1, Strongly disagree | 2, Somewhat disagree | 3, Somewhat agree | 4, Strongly agree",,,,,,,,,,acts_mg,,
pa_6,cchs_questionnaire,,radio,"I enjoy exercise and physical activity.","1, Strongly disagree | 2, Somewhat disagree | 3, Somewhat agree | 4, Strongly agree",,,,,,,,,,acts_mg,,
pa_7,cchs_questionnaire,,radio,"I encourage my child to use resources in our neighborhood to be active (such as the park and the school).","1, Strongly disagree | 2, Somewhat disagree | 3, Somewhat agree | 4, Strongly agree",,,,,,,,,,acts_mg,,
pa_8,cchs_questionnaire,,radio,"I enroll my child in community-based programs (such as Girls and Boys Club, YMCA) where he/she can be active.","1, Strongly disagree | 2, Somewhat disagree | 3, Somewhat agree | 4, Strongly agree",,,,,,,,,,acts_mg,,
pa_9,cchs_questionnaire,,radio,"I find ways for my child to be active when school is out by, for example, enrolling him/her in summer camp and after school programs.","1, Strongly disagree | 2, Somewhat disagree | 3, Somewhat agree | 4, Strongly agree",,,,,,,,,,acts_mg,,
pa_10,cchs_questionnaire,,radio,"I limit how long my child plays video games (including playstation, Xbox, and gameboys).","1, Strongly disagree | 2, Somewhat disagree | 3, Somewhat agree | 4, Strongly agree",,,,,,,,,,acts_mg,,
pa_11,cchs_questionnaire,,radio,"I limit how long my child can watch TV or DVDs each day (including educational and non-educational programs).","1, Strongly disagree | 2, Somewhat disagree | 3, Somewhat agree | 4, Strongly agree",,,,,,,,,,acts_mg,,
pa_12,cchs_questionnaire,,radio,"I limit how long my child can use the computer for things other than homework (such as playing computer games and surfing the internet).","1, Strongly disagree | 2, Somewhat disagree | 3, Somewhat agree | 4, Strongly agree",,,,,,,,,,acts_mg,,
demo_1,cchs_questionnaire,"<div class=""rich-text-field-label""><h2>You and Your Family</h2> <p>This last section of the survey will ask about you and your family</p></div>",text,"What is your ZIP code?",,,zipcode,,,y,,,,,,,
demo_2,cchs_questionnaire,,dropdown,"In which county do you live?","1, Adams | 2, Alexander | 3, Bond | 4, Boone | 5, Brown | 6, Bureau | 7, Calhoun | 8, Carroll | 9, Cass | 10, Champaign | 11, Christian | 12, Clark | 13, Clay | 14, Clinton | 15, Coles | 16, Cook | 17, Crawford | 18, Cumberland | 19, De Kalb | 20, De Witt | 21, Douglas | 22, Du Page | 23, Edgar | 24, Edwards | 25, Effingham | 26, Fayette | 27, Ford | 28, Franklin | 29, Fulton | 30, Gallatin | 31, Greene | 32, Grundy | 33, Hamilton | 34, Hancock | 35, Hardin | 36, Henderson | 37, Henry | 38, Iroquois | 39, Jackson | 40, Jasper | 41, Jefferson | 42, Jersey | 43, Jo Daviess | 44, Johnson | 45, Kane | 46, Kankakee | 47, Kendall | 48, Knox | 49, La Salle | 50, Lake | 51, Lawrence | 52, Lee | 53, Livingston | 54, Logan | 55, Macon | 56, Macoupin | 57, Madison | 58, Marion | 59, Marshall | 60, Mason | 61, Massac | 62, McDonough | 63, McHenry | 64, McLean | 65, Menard | 66, Mercer | 67, Monroe | 68, Montgomery | 69, Morgan | 70, Moultrie | 71, Ogle | 72, Peoria | 73, Perry | 74, Piatt | 75, Pike | 76, Pope | 77, Pulaski | 78, Putnam | 79, Randolph | 80, Richland | 81, Rock Island | 82, Saline | 83, Sangamon | 84, Schuyler | 85, Scott | 86, Shelby | 87, St. Clair | 88, Stark | 89, Stephenson | 90, Tazewell | 91, Union | 92, Vermilion | 93, Wabash | 94, Warren | 95, Washington | 96, Wayne | 97, White | 98, Whiteside | 99, Will | 100, Williamson | 101, Winnebago | 102, Woodford",,autocomplete,,,,,,,,,,
demo_3,cchs_questionnaire,,radio,"How would you describe the place where you live?","1, Urban | 2, Suburban | 3, Rural",,,,,,,,,,,,
demo_4,cchs_questionnaire,,text,"In what year were you born?",,,integer,1900,2009,,,,,,,,
demo_5,cchs_questionnaire,,radio,"What is your gender?","1, Female | 2, Male | 3, Agender, non-binary, gender non-conforming, or other gender identity | 4, Other | 5, Prefer not to answer",,,,,,,,,,,,
demo_5a,cchs_questionnaire,,text,"Please specify your gender:",,,,,,,"[demo_5] = '4'",,,,,,
demo_6,cchs_questionnaire,,checkbox,"What race or ethnicity group(s) best describe(s) you? Select all that apply:","1, American Indian or Alaska Native | 2, Asian/Pacific Islander | 3, Black or African American | 4, White or Caucasian | 5, Hispanic or Latino/a/x | 6, Middle Eastern or North African | 7, Other | 8, Prefer not to answer",,,,,,,,,,,,
demo_6a,cchs_questionnaire,,text,"Please specify what race or ethnicity group(s) best describe(s) you:",,,,,,y,"[demo_6(7)] = '1'",,,,,,
demo_7,cchs_questionnaire,,text,"How many years have you lived in your home?",,,number,0,100,,,,,,,,
demo_8,cchs_questionnaire,,radio,"In general, your health is:","1, Excellent | 2, Very good | 3, Good | 4, Fair | 5, Poor",,,,,,,,,,,,
demo_9,cchs_questionnaire,,checkbox,"What language(s) do you speak at home? Select all that apply:","1, English | 2, Spanish | 3, Cantonese or Mandarin | 4, Tagalog or Filipino | 5, Vietnamese | 6, Arabic | 7, French | 8, Korean | 9, Russian | 10, Portuguese | 11, Other | 12, Prefer not to answer",,,,,,,,,,,,
demo_9a,cchs_questionnaire,,text,"Please specify what language(s) you speak at home:",,,,,,,"[demo_9(11)] = '1'",,,,,,
demo_10,cchs_questionnaire,,radio,"What is your annual household income?","1, Less than or equal to $25,000 per year | 2, $25,001 - $45,000 per year | 3, $45,001 - $65,000 per year | 4, $65,001 - $85,000 per year | 5, $85,001 - $100,000 per year | 6, $100,001 - $150,000 per year | 7, $150,001 - $200,000 per year | 8, More than $200,000 per year | 9, Don't know or prefer not to answer",,,,,,,,,,,,
demo_11a,cchs_questionnaire,"The terms 'liberal' and 'conservative' may mean different things to different people depending on the kind of issue one is considering. How would you describe your view in terms of:",radio,"Economic issues?","1, Very liberal | 2, Liberal | 3, Neither liberal nor conservative | 4, Conservative | 5, Very conservative",,,,,,,,,,political_viewpoint,,
demo_11b,cchs_questionnaire,,radio,"Social issues?","1, Very liberal | 2, Liberal | 3, Neither liberal nor conservative | 4, Conservative | 5, Very conservative",,,,,,,,,,political_viewpoint,,
demo_12,cchs_questionnaire," ",text,"Other than you, how many adults (ages 18 and older) live in your home at least half time? ",,,integer,0,20,,,,,,,,
demo_13,cchs_questionnaire,,radio,"Is anyone living in your home currently pregnant?","1, Yes | 2, No | 3, I don't know",,,,,,,,,,,,
demo_14,cchs_questionnaire,,radio,"What is your highest level of education?","1, 12 years of school or fewer with no diploma or GED | 2, High school diploma or GED | 3, Some college coursework but no degree | 4, Associate degree | 5, Bachelor's degree | 6, Graduate or professional degree | 7, Prefer not to answer",,,,,,,,,,,,
contact_1,cchs_questionnaire," ",yesno,"Would you like to receive an emailed report summarizing our findings at the end of the study? No identifiable information will be included in this summary.",,,,,,,,,,,,,
contact_1a,cchs_questionnaire,,text,"Please provide your email address where we can send a report summarizing our research findings:",,,email,,,y,"[contact_1] = '1'",,,,,,
contact_2,cchs_questionnaire,,yesno,"May we contact you about future research opportunities?",,,,,,,,,,,,,
contact_2a,cchs_questionnaire,,text,"Please provide your email address where we can contact you about future research opportunities:",,,email,,,y,"[contact_2] = '1'",,,,,,
survey_duration,cchs_questionnaire,,calc,,[survey-duration-completed:cchs_questionnaire:m],,,,,,,,,,,," @HIDDEN-SURVEY"
